{
  "$schema": "http://json-schema.org/draft-04/schema#",
  "id": "http://justice.gov.uk/progression/query/laa/application-laa.json",
  "type": "object",
  "properties": {
    "applicationId": {
      "$ref": "http://justice.gov.uk/core/courts/external/apiCourtsDefinitions.json#/definitions/uuid"
    },
    "applicationReference": {
      "description": "The LAA issued reference to the application.  Currently known as the MAAT Id",
      "type": "string"
    },
    "applicationStatus": {
      "description": "Indicates if the application is draft, listed or finalised",
      "$ref": "http://justice.gov.uk/core/courts/external/apiCourtsDefinitions.json#/definitions/courtApplicationStatus"
    },
    "applicationTitle": {
      "description": "The CJS Title for the court application type",
      "type": "string"
    },
    "applicationType": {
      "description": "The value of the Application.type.type",
      "type": "string"
    },
    "receivedDate": {
      "type": "string",
      "format": "date"
    },
    "judicialResults": {
      "type": "array",
      "minItems": 1,
      "items": {
        "$ref": "http://justice.gov.uk/core/courts/external/apiJudicialResult.json"
      }
    },
    "caseSummary": {
      "type": "array",
      "items": [
        {
          "type": "object",
          "id": "http://justice.gov.uk/progression/query/laa/case-summary.json",
          "properties": {
            "caseStatus": {
              "type": "string"
            },
            "prosecutionCaseId": {
              "$ref": "http://justice.gov.uk/core/courts/external/apiCourtsDefinitions.json#/definitions/uuid"
            },
            "prosecutionCaseReference": {
              "description": "The URN or PRN of the case",
              "type": "string"
            }
          },
          "additionalProperties": false
        }
      ]
    },
    "hearingSummary": {
      "type": "array",
      "items": [
        {
          "id": "http://justice.gov.uk/progression/query/laa/hearing-summary.json",
          "type": "object",
          "properties": {
            "hearingId": {
              "$ref": "http://justice.gov.uk/core/courts/external/apiCourtsDefinitions.json#/definitions/uuid"
            },
            "jurisdictionType": {
              "type": "string"
            },
            "estimatedDuration": {
              "type": "string"
            },
            "defendantIds": {
              "type": "array",
              "items": [
                {
                  "$ref": "http://justice.gov.uk/core/courts/external/apiCourtsDefinitions.json#/definitions/uuid"
                }
              ]
            },
            "hearingType": {
              "type": "object",
              "id": "http://justice.gov.uk/progression/query/laa/hearing-type.json",
              "properties": {
                "id": {
                  "$ref": "http://justice.gov.uk/core/courts/external/apiCourtsDefinitions.json#/definitions/uuid"
                },
                "description": {
                  "type": "string"
                },
                "code": {
                  "type": "string"
                }
              },
              "required": [
                "id",
                "description"
              ],
              "additionalProperties": false
            },
            "courtCentre": {
              "id": "http://justice.gov.uk/progression/query/laa/court-centre.json",
              "type": "object",
              "properties": {
                "id": {
                  "$ref": "http://justice.gov.uk/core/courts/external/apiCourtsDefinitions.json#/definitions/uuid"
                },
                "code": {
                  "type": "string"
                },
                "name": {
                  "type": "string"
                },
                "roomId": {
                  "$ref": "http://justice.gov.uk/core/courts/external/apiCourtsDefinitions.json#/definitions/uuid"
                },
                "roomName": {
                  "type": "string"
                },
                "welshName": {
                  "type": "string"
                },
                "welshRoomName": {
                  "type": "string"
                },
                "address": {
                  "id": "http://justice.gov.uk/progression/query/laa/address.json",
                  "type": "object",
                  "properties": {
                    "address1": {
                      "type": "string"
                    },
                    "address2": {
                      "type": "string"
                    },
                    "address3": {
                      "type": "string"
                    },
                    "address4": {
                      "type": "string"
                    },
                    "postCode": {
                      "type": "string"
                    }
                  },
                  "required": [
                    "address1",
                    "postCode"
                  ],
                  "additionalProperties": false
                }
              },
              "required": [
                "id",
                "name",
                "roomId",
                "roomName"
              ],
              "additionalProperties": false
            },
            "hearingDay": {
              "type": "array",
              "items": [
                {
                  "id": "http://justice.gov.uk/progression/query/laa/hearing-day.json",
                  "type": "object",
                  "properties": {
                    "sittingDay": {
                      "type": "string"
                    },
                    "listingSequence": {
                      "type": "integer"
                    },
                    "listedDurationMinutes": {
                      "type": "integer"
                    },
                    "hasSharedResults": {
                      "type": "boolean"
                    }
                  },
                  "required": [
                    "sittingDay"
                  ],
                  "additionalProperties": false
                }
              ]
            },
            "defenceCounsel": {
              "type": "array",
              "items": [
                {
                  "id": "http://justice.gov.uk/progression/query/laa/defence-counsel.json",
                  "type": "object",
                  "properties": {
                    "id": {
                      "$ref": "http://justice.gov.uk/core/courts/external/apiCourtsDefinitions.json#/definitions/uuid"
                    },
                    "title": {
                      "type": "string"
                    },
                    "firstName": {
                      "type": "string"
                    },
                    "middleName": {
                      "type": "string"
                    },
                    "lastName": {
                      "type": "string"
                    },
                    "status": {
                      "type": "string"
                    },
                    "defendants": {
                      "type": "array",
                      "items": [
                        {
                          "$ref": "http://justice.gov.uk/core/courts/external/apiCourtsDefinitions.json#/definitions/uuid"
                        }
                      ]
                    },
                    "attendanceDays": {
                      "type": "array",
                      "items": [
                        {
                          "type": "string"
                        }
                      ]
                    }
                  },
                  "additionalProperties": false
                }
              ]
            }
          },
          "required": [
            "hearingId",
            "hearingType",
            "courtCentre",
            "hearingDay"
          ],
          "additionalProperties": false
        }
      ]
    },
    "subjectSummary":  {
      "id": "http://justice.gov.uk/progression/query/laa/subject-summary.json",
      "type": "object",
      "properties": {
        "proceedingsConcluded": {
          "type": "boolean"
        },
        "subjectId": {
          "$ref": "http://justice.gov.uk/core/courts/external/apiCourtsDefinitions.json#/definitions/uuid"
        },
        "masterDefendantId": {
          "$ref": "http://justice.gov.uk/core/courts/external/apiCourtsDefinitions.json#/definitions/uuid"
        },
        "defendantASN": {
          "type": "string"
        },
        "defendantFirstName": {
          "type": "string"
        },
        "defendantMiddleName": {
          "type": "string"
        },
        "defendantLastName": {
          "type": "string"
        },
        "defendantDOB": {
          "type": "string"
        },
        "defendantNINO": {
          "type": "string"
        },
        "dateOfNextHearing": {
          "type": "string"
        },
        "representationOrder": {
          "id": "http://justice.gov.uk/progression/query/laa/representation-order.json",
          "type": "object",
          "properties": {
            "applicationReference": {
              "type": "string"
            },
            "effectiveFromDate": {
              "type": "string",
              "format": "date"
            },
            "effectiveToDate": {
              "type": "string",
              "format": "date"
            },
            "laaContractNumber": {
              "type": "string"
            }
          },
          "required": [
            "applicationReference"
          ],
          "additionalProperties": false
        },
        "offenceSummary": {
          "type": "array",
          "items": [
            {
              "id": "http://justice.gov.uk/progression/query/laa/offence-summary.json",
              "type": "object",
              "properties": {
                "offenceId": {
                  "$ref": "http://justice.gov.uk/core/courts/external/apiCourtsDefinitions.json#/definitions/uuid"
                },
                "offenceCode": {
                  "type": "string"
                },
                "offenceTitle": {
                  "type": "string"
                },
                "offenceLegislation": {
                  "type": "string"
                },
                "proceedingsConcluded": {
                  "type": "boolean"
                },
                "arrestDate": {
                  "type": "string"
                },
                "dateOfInformation": {
                  "type": "string"
                },
                "endDate": {
                  "type": "string"
                },
                "startDate": {
                  "type": "string"
                },
                "chargeDate": {
                  "type": "string"
                },
                "modeOfTrial": {
                  "type": "string"
                },
                "orderIndex": {
                  "type": "integer"
                },
                "wording": {
                  "type": "string"
                },
                "laaApplnReference": {
                  "id": "http://justice.gov.uk/progression/query/laa/laa-appln-reference.json",
                  "type": "object",
                  "properties": {
                    "applicationReference": {
                      "type": "string"
                    },
                    "statusId": {
                      "type": "string"
                    },
                    "statusCode": {
                      "type": "string"
                    },
                    "statusDescription": {
                      "type": "string"
                    }
                  },
                  "required": [
                    "applicationReference",
                    "statusId",
                    "statusCode",
                    "statusDescription"
                  ],
                  "additionalProperties": false
                }
              },
              "required": [
                "offenceId",
                "offenceCode",
                "offenceTitle",
                "offenceLegislation",
                "proceedingsConcluded",
                "arrestDate",
                "startDate",
                "chargeDate",
                "modeOfTrial",
                "orderIndex",
                "wording"
              ],
              "additionalProperties": false
            }
          ]
        }
      },
      "required": [
        "subjectId",
        "defendantFirstName"
      ],
      "additionalProperties": false
    }
  },
  "required": [
    "applicationId",
    "applicationReference",
    "applicationStatus"
  ],
  "additionalProperties": false
}
